{
	"$schema": "../mistySdk.schema.json",
	"Name": "lookAround",
	"Description": "Have Misty look around",
	"UniqueId": "9924c6ff-65d6-412f-a3c7-fac6b99adfe9",
	"StartupRules": [ "Manual", "Robot" ],
	"Language": "javascript",
	"BroadcastMode": "debug",
	"CleanupOnCancel": true,
	"TimeoutInSeconds": 600
}
